{
  "id": "tpl_retail_001",
  "name": "Artisan Coffee - Local Store",
  "slug": "artisan-coffee-local",
  "industry": "retail",
  "description": "Local coffee shop website with product showcase and online ordering",
  "theme": {
    "useSiteDefaults": true,
    "overrides": {
      "palette": {
        "primary": "#8b4513",
        "secondary": "#d2691e",
        "accent": "#f4a261"
      }
    }
  },
  "components": [
    {
      "id": "c_header_1",
      "type": "header",
      "version": "1.0.0",
      "props": {
        "logo": {
          "type": "text",
          "content": "Artisan Coffee",
          "size": "md"
        },
        "navigation": [
          {
            "label": "Menu",
            "href": "#menu"
          },
          {
            "label": "About",
            "href": "#about"
          },
          {
            "label": "Location",
            "href": "#location"
          },
          {
            "label": "Order Online",
            "href": "#order"
          }
        ],
        "showThemeToggle": false,
        "sticky": true,
        "background": "solid"
      }
    },
    {
      "id": "c_hero_1",
      "type": "hero",
      "version": "1.0.0",
      "props": {
        "title": "Handcrafted Coffee",
        "subtitle": "Roasted fresh daily",
        "description": "Experience the perfect cup of coffee made from ethically sourced beans, roasted in small batches right here in downtown.",
        "media": {
          "type": "image",
          "assetId": "assets/coffee_hero.jpg",
          "alt": "Fresh coffee beans and brewing equipment"
        },
        "cta": {
          "label": "Order Now",
          "action": {
            "type": "scroll_to",
            "target": "#order"
          },
          "style": "primary",
          "size": "lg"
        },
        "secondaryCTA": {
          "label": "View Menu",
          "action": {
            "type": "scroll_to",
            "target": "#menu"
          },
          "style": "outline",
          "size": "lg"
        },
        "background": "image",
        "layout": "left",
        "animation": true
      }
    },
    {
      "id": "c_feature_grid_1",
      "type": "feature_grid",
      "version": "1.0.0",
      "props": {
        "title": "Why Choose Artisan Coffee",
        "features": [
          {
            "icon": "Coffee",
            "title": "Fresh Roasted",
            "description": "Beans roasted daily in our shop for maximum freshness and flavor"
          },
          {
            "icon": "Heart",
            "title": "Ethically Sourced",
            "description": "Direct trade relationships with coffee farmers around the world"
          },
          {
            "icon": "Award",
            "title": "Award Winning",
            "description": "Recognized as 'Best Local Coffee Shop' three years running"
          },
          {
            "icon": "MapPin",
            "title": "Local Favorite",
            "description": "Proudly serving our community for over 10 years"
          }
        ],
        "columns": 2,
        "layout": "icons",
        "spacing": "relaxed"
      }
    },
    {
      "id": "c_text_1",
      "type": "text",
      "version": "1.0.0",
      "props": {
        "content": "## Our Story\n\nFounded in 2014 by coffee enthusiasts Sarah and Mike, Artisan Coffee began as a dream to bring exceptional coffee to our local community. What started as a small corner shop has grown into a beloved gathering place where neighbors become friends over perfectly crafted cups of coffee.\n\nWe believe that great coffee brings people together, and every cup we serve is made with care, attention to detail, and a commitment to quality that you can taste.",
        "format": "markdown",
        "alignment": "left",
        "size": "md"
      }
    },
    {
      "id": "c_card_1",
      "type": "card",
      "version": "1.0.0",
      "props": {
        "title": "Visit Our Shop",
        "description": "Experience the Artisan Coffee atmosphere in person",
        "content": "**Hours:**\nMonday - Friday: 6:00 AM - 8:00 PM\nSaturday - Sunday: 7:00 AM - 9:00 PM\n\n**Location:**\n123 Main Street\nDowntown District\n\n**Phone:** (555) 123-BREW",
        "style": "glass",
        "padding": "lg",
        "hover": true
      }
    },
    {
      "id": "form_contact_1",
      "type": "form",
      "version": "1.0.0",
      "props": {
        "title": "Get in Touch",
        "description": "Questions about our coffee, catering, or special events? We'd love to hear from you!",
        "fields": [
          {
            "id": "f1",
            "name": "name",
            "type": "text",
            "label": "Your Name",
            "required": true
          },
          {
            "id": "f2",
            "name": "email",
            "type": "email",
            "label": "Email Address",
            "required": true
          },
          {
            "id": "f3",
            "name": "subject",
            "type": "select",
            "label": "Subject",
            "required": true,
            "options": [
              {
                "label": "General Question",
                "value": "general"
              },
              {
                "label": "Catering Inquiry",
                "value": "catering"
              },
              {
                "label": "Private Events",
                "value": "events"
              },
              {
                "label": "Wholesale/Business",
                "value": "wholesale"
              }
            ]
          },
          {
            "id": "f4",
            "name": "message",
            "type": "textarea",
            "label": "Message",
            "placeholder": "Tell us how we can help you...",
            "required": true,
            "validation": {
              "minLength": 10,
              "maxLength": 1000
            }
          }
        ],
        "submission": {
          "type": "email",
          "target": "hello@artisancoffee.local",
          "successAction": {
            "type": "message",
            "message": "Thanks for reaching out! We'll get back to you within 24 hours."
          }
        },
        "layout": "vertical",
        "options": {
          "spamProtection": true
        }
      }
    },
    {
      "id": "c_cta_1",
      "type": "cta",
      "version": "1.0.0",
      "props": {
        "title": "Start your day right",
        "description": "Join us for freshly roasted coffee and a warm community atmosphere",
        "buttons": [
          {
            "label": "Visit Our Shop",
            "action": {
              "type": "external",
              "target": "https://maps.google.com/directions-to-artisan-coffee"
            },
            "style": "primary",
            "size": "lg"
          },
          {
            "label": "Call to Order",
            "action": {
              "type": "external",
              "target": "tel:+15551234273"
            },
            "style": "secondary",
            "size": "lg"
          }
        ],
        "background": "solid",
        "alignment": "center",
        "spacing": "lg"
      }
    }
  ],
  "meta": {
    "version": "1.0.0",
    "createdBy": "team_dct",
    "createdAt": "2025-09-17",
    "tags": ["retail", "coffee", "local-business", "community"],
    "previewUrl": "https://preview.automationdct.com/tpl_retail_001"
  }
}